{
    "id": "5f5ce4b2-a919-4166-b6e4-dd9040aff644",
    "createdAt": "2025-08-17T12:56:31.413183+00:00",
    "qa_filename": "質問・正解(f).csv",
    "context_filename": "文脈(f).csv",
    "models_tested": [
        "gemini-1.5-flash-latest"
    ],
    "advanced_options": {
        "chunking": false,
        "hybridSearch": false,
        "promptTuning": false
    },
    "num_questions": 1,
    "results": [
        {
            "results_by_question": [
                {
                    "question": "f.ドイツのサステナビリティ保証制度の実務訓練は何か月か？",
                    "ground_truth": "少なくとも8か月の実務訓練",
                    "generated_answer": "この文章には、ドイツのサステナビリティ保証制度に関する情報は含まれていません。そのため、質問にお答えすることはできません。",
                    "retrieved_contexts": [
                        "2024年４月17日決定\nマネロン・テロ資金供与・拡散金融対策政策会議\nマネロン・テロ資金供与・拡散金融対策に関する行動計画（2024-2026 年度）\nIO.1 マネロン・テロ資金供与・拡散金融に係るリスクの認識・協調\n項目 行動内容 期限 担当府省庁等\n(1) ｢政策会議｣の体制 マネロンによる不正な資金の流れの複雑化・多様化に的確に対応するため、 令和６年度末 警察庁、財務省、金融庁、\n強化 マネロン・テロ資金供与・拡散金融対策政策会議（以下、「政策会議」）の 法務省、外務省、その他\n参加省庁拡大等により、｢政策会議｣の体制を強化する。 関係省庁\n(2) 「基本方針」等の進 マネロン・テロ資金供与・拡散金融対策の推進に関する基本方針（2022年 継続実施 同上\n捗管理及び更新 5 月 19 日決定・公表）（以下、「基本方針」）及び本行動計画の進捗状況を\n「政策会議」でフォローアップし、必要に応じ「基本方針」を更新する。\n我が国のマネロン・テロ資金供与・拡散金融対策(以下、｢マネロン等対策｣) 令和６年度末 同上\nの強化の進捗状況を的確に把握するため、FATF基準も踏まえ、適切な統計\nデータ等を特定し、継続的に把握する。\n関係省庁及び業界団体が緊密に連携し、マネロン等対策の強化に向けて取 令和８年度末 同上\nり組むため、次期「基本方針」等の検討において、民間有識者及び関係業\n界団体等の意見を聴取し、聴取した意見を反映させる。\n(3) 国内外情勢の変化 国内外の情勢変化等を踏まえタイムリーにリスク評価を見直すこととし、 継続実施 同上\n等を踏まえたタイ 犯罪収益移転危険度調査書については毎年、拡散金融リスク評価書につい\nムリーなリスク評 ては定期的に更新する。\n価の更新等 犯罪収益移転危険度調査書及び拡散金融リスク評価書等を踏まえ、定期的 継続実施 同上\nな意見交換等の場を設け、関係省庁間でリスク認識の向上につなげる。\nIO.２ 国際協力\n項目 行動内容 期限 担当府省庁等\n(1) 国際機関等との連 FATF、APG の活動支援等を通じ、国際的なマネロン等対策に貢献すると 継続実施 警察庁、財務省、外務省\n携強化 ともに、インターポール、エグモント・グループ等の国際機関等との連携\n1\n強化に取り組む。\n(2) 効果的かつ時機を 国際業務に従事する検察庁及び警察職員に対して、捜査共助・逃亡犯罪人 継続実施 法務省、警察庁\n得た捜査共助・逃亡 引渡に関するトレーニングを実施し、これら手続に対する理解を深め、積\n犯罪人引渡の実施 極的な活用につなげる。\n(3) 外国のカウンター JAFIC と外国 FIU の情報交換がより広範かつ効果的なものとなるよう、 継続実施 警察庁、外務省\nパートとの(2)以外 FIU 間の情報交換枠組みの一層の充実を図るとともに、活発な情報交換を\nの情報交換の促進 実施する。\n外国当局から要請された口座凍結に対し、適切な対応を推進する。 継続実施 同上\n監督当局等による他国のカウンターパートとのマネロン・テロ資金供与等 継続実施 金融庁、その他特定事業\nに関する情報交換を継続するとともに、必要に応じて更に発展させる。 者監督官庁\nIO.３ マネロン・テロ資金供与対策に係る金融機関・暗号資産交換業者（VASPs）の監督・予防措置\n項目 行動内容 期限 担当府省庁等\n(1) 金融機関等による マネロン・テロ資金供与対策に係る重要性等の周知徹底により、金融機関・ 継続実施 金融庁、その他金融機関\nリスクベースアプ 暗号資産交換業者（以下、「金融機関等」）のリスク理解を更に向上させ、 監督省庁\nローチに基づく取 リスク評価に基づくリスクベースの実効性ある取組を促す。また、必要に\n組の促進等 応じて、マネロン・テロ資金供与対策に関する検査監督ガイドラインを更\n新する。\n政府広報も活用して、官民が連携して国民の理解を促進しつつ、金融機関 継続実施 同上\n等による継続的な顧客情報管理に基づく顧客のリスク評価の取組を推進す\nる。\n(2) 監督当局による金 マネロン・テロ資金供与対策に関するノウハウの共有や共同研修の実施な 継続実施 同上\n融機関等に対する どの監督当局間連携の取組を推進するとともに、リスクベースアプローチ\nリスクベースアプ に基づくメリハリのある検査監督の取組を実践する。ブロックチェーンや\nローチに基づく検 暗号資産等を活用した技術による新たな金融商品・サービスを提供する金\n査監督の実践等 融機関等において、必要なリスク低減措置等が実施されるよう取り組む。\n2\nまた、金融機関等の取組を改善させるため、効果的かつ抑止力のある措置 継続実施 同上\nを実施する。\n(3) 取引モニタリング 為替取引分析業者の検査監督等を通じて、共同システムの安定運営を確保 継続実施 同上\n共同システムの充 しつつ、金融機関等による取引モニタリング等を強化する。\n実・効率化、金融機\n関等の取引モニタ\nリング等の強化\nIO.４ マネロン・テロ資金供与対策に係る特定非金融業者及び職業専門家（DNFBPs）の監督・予防措置\n項目 行動内容 期限 担当府省庁等\n(1) DNFBPs のリスク マネロン・テロ資金供与対策に関するガイドライン等の周知徹底により、 令和８年度末 DNFBPs監督官庁、警察\n理解向上とリスク DNFBPsのリスク理解を向上させ、適切なリスクベースアプローチに基づ 庁、財務省\nベースアプローチ く取組を促す。その上で、必要に応じて、ガイドラインの更新やガイドラ\nに基づく取組の促 インに関するよくある質問（FAQ）の策定を行う。\n進等 また、マネロン・テロ資金供与対策に関するガイドラインの実施期限を明\n確化する。\n取引モニタリングを強化するとともに、政府広報も活用して国民の理解を 令和８年度末 警察庁、財務省、DNFBPs\n促進しつつ、DNFBPsによる取引時確認及び継続的顧客管理の実効性を確 監督官庁\n保する。\n(2) 監 督 当 局 に よ る ｢政策会議｣等において、モニタリング手法や参考事例、ベストプラクティ 令和６年度末 同上\nDNFBPs に対する スを共有することにより、監督当局によるマネロン・テロ資金供与対策に\nリスクベースアプ 係るリスクベースでの検査監督を強化する。\nローチに基づく検 各業界団体と政府当局との定期協議の場を設けるとともに、関係省庁間で 令和６年度末 同上\n査監督の強化 連携して地方公共団体を含む担当者の能力向上のための研修プログラムを\n作成し、実施する。\n監督当局によるリスクベースでの検査監督を実施するため、モニタリング 令和７年度末 DNFBPs監督官庁、警察\n3\n方針を策定する。 庁、財務省\n(3) 疑わしい取引の届 疑わしい取引の届出の実効性を高めるため、必要に応じて、疑わしい取引 令和８年度末 警察庁、財務省、DNFBPs\n出の推進強化及び の参考事例を作成・更新するとともに、疑わしい取引参考事例の共有やア 監督官庁\n向上 ウトリーチの実施等によりDNFBPsの理解を深めることにより、疑わしい\n取引の届出の推進強化及び質・件数の向上につなげる。\nIO.５ 法人等の悪用防止\n項目 行動内容 期限 担当府省庁等\n(1) 法人の実質的支配 法人の実質的支配者情報に関する制度整備に向けた検討を推進しながら、 令和８年度末 法務省、財務省、警察庁、\n者情報に関する制 株式会社が自らの実質的支配者情報を特定するため、株主である他の株式 金融庁、経済産業省、そ\n度の改善と実効性 会社の実質的支配者リストを活用する方策を検討し、所要の措置を講じる。 の他特定事業者監督省\n向上 併せて、株式会社をはじめとする法人が自身の実質的支配者情報を把握す 庁、その他法人設立根拠\nることの重要性を周知する。 法所管省庁\n実質的支配者リスト制度の実効性を高めるため、引き続きその積極的な活\n用を政府として推進するとともに、金融機関等による直接の確認等の検討\nを含む制度の利便性向上や商業登記制度との連携による実質的支配者リス\nト制度の活用場面の確保にも取り組み、所要の措置を講じる。\n(2) 法人の実質的支配 特定事業者が保持する実質的支配者情報を十分、正確、最新な状態に保つ 令和８年度末 金融庁、警察庁、財務省、\n者情報への当局に ための措置を行うとともに、当局による当該情報への効率的なアクセスを 法務省、その他特定事業\nよるアクセス強化 確保する仕組みを検討し、導入する。 者監督省庁\n公証人が定款認証を通じて保有する実質的支配者情報への当局による照会\nについての対応を一層迅速化する。\n(3) 法人・信託に関する 外国で設立された法人や民事・外国信託について、日本においてマネロン 令和７年度末 警察庁、財務省、金融庁、\nリスク評価 等に悪用されるリスクの評価を行い、必要なリスク低減措置を検討する。 法務省\nIO.６ 特定金融情報の活用\n項目 行動内容 期限 担当府省庁等\n4\n(1) 疑わしい取引の届 JAFICの疑わしい取引の届出の分析にICT／AI技術を積極的に活用するこ 継続実施 警察庁\n出の分析の高度化 とにより、分析の実効性・効率性の向上につなげる。\n(2) 関係機関の連携強 JAFICからの情報提供の充実や、定期的な意見交換等の場を設け、関係機 継続実施 警察庁、特定事業者監督\n化 関との連携を強化する。 官庁\nIO.７ マネロンの捜査・訴追・制裁\n項目 行動内容 期限 担当府省庁等\n(1) リスクに応じたマ 高リスクと特定された前提犯罪について、とりわけ重大複雑な事案（外国 継続実施 法務省、警察庁\nネロン事案の捜査・ において前提犯罪が行われた場合を含む）に係るマネロンの捜査・訴追を\n訴追 推進するため、リスクの理解向上に努めるとともに、各種通達や研修のほ\nか、タスクフォースの枠組みに基づいて、関係省庁が連携して捜査・訴追\nに取り組む。\nマネロン罪の捜査や訴追における電子化の推進について検討し、所要の措 継続実施 同上\n置を講じる。\n(2) 効果的で均衡のと 各種通達や研修等に基づいて、マネロン罪について適切な量刑を確保する 継続実施 法務省\nれた抑止力のある べく取り組む。\n量刑の確保\nIO.８ 犯罪収益の没収\n項目 行動内容 期限 担当府省庁等\n(1) 捜査・没収の執行 犯罪収益や、マネロンに関連する犯罪供用物の押収・没収・追徴を適切に 継続実施 法務省、警察庁\n実施するため、リスクが高い分野に関する犯罪収益追跡捜査、保全措置及\nび没収・追徴を執行する。\nマネロン等に関連する現金等の国境での差し止め、現金等の輸出入情報の 継続実施 財務省、警察庁\n警察庁への共有及び官民連携した取締り等を引き続き行うとともに、カレ\nンシードッグの導入を始めとした新たな取締手法等、国境での取締り体制\n5\nの強化に取り組む。\n(2) 適切な口座凍結検 預貯金口座や暗号資産取引口座に関して、迅速かつ確実な凍結検討依頼を 継続実施 警察庁、金融庁\n討依頼の実施 行う。\n(3) 財産回復に係る勧 財産回復に係る勧告 4 及び勧告 38 の改訂並びにそれを受けたメソドロジ 令和8年度末 法務省、警察庁、財務省、\n告4及び38の改訂 ーの改訂を踏まえ、政府内で諸外国の制度調査等を行うとともに、国内に 金融庁\n対応 おける対応を協議のうえ、必要に応じ措置を講じる。\nIO.９ テロ資金の捜査・訴追・制裁\n項目 行動内容 期限 担当府省庁等\n(1) テロ資金等提供罪 テロ資金等提供罪の捜査や訴追における電子化の推進について検討し、所 継続実施 法務省、警察庁\nの捜査・訴追 要の措置を講じる。\n重大複雑なテロ資金供与の更なる捜査・訴追のため、タスクフォースの枠 継続実施 法務省、警察庁、その他\n組みや各種通達に基づいて、関係省庁が連携し、態勢整備も含め捜査・訴 関係省庁\n追の執行を強化する。また、必要に応じて、国内外のテロ資金供与の状況\n変化も踏まえた新たな取組を検討する。\nIO.10 テロ資金の凍結・NPOの悪用防止\n項目 行動内容 期限 担当府省庁等\n(1) 関係機関の連携強 遅滞なき資産凍結等の実施強化のため、迅速な制裁対象者情報の通知やベ 令和７年度末 外務省、財務省、経済産\n化 ストプラクティスの共有など、関係省庁及び特定事業者（金融機関等及び 業省、警察庁、特定事業\nDNFBPs）との連携の枠組みを強化する。 者監督官庁\n(2) テロ資金の凍結に 外為法及び国際テロリスト等財産凍結法で対応すべき事項及びその具体的 令和７年度末 特定事業者監督官庁、財\n係る事業者の理解 な対応方法を特定事業者に対し周知することで、リスク理解の向上につな 務省、警察庁\nの向上 げる。\n(3) 外国為替取引等取 外国為替取引等取扱業者によるテロ資金供与対策の態勢整備状況及びリス 令和７年度末 財務省\n扱業者に対するテ クに応じた対応状況について、経済制裁の迂回・潜脱等の検知を含め、リ\nロ資金の凍結に係 スクベースでの検査監督を強化する。\n6\nる検査監督の強化\n(4) NPOの悪用防止 NPOがテロ資金供与目的で悪用されることを防ぐため、ターゲットを絞っ 継続実施 内閣府、文科省、厚労省、\nたアウトリーチやモニタリングを継続する。 外務省、警察庁、財務省\nNPO に係る勧告 8 改訂及びそれを受けたメソドロジーの改訂を踏まえ、 令和７年度末 同上\n必要な対応を政府内で協議・実施する。\nIO.11 大量破壊兵器の拡散金融対策\n項目 行動内容 期限 担当府省庁等\n(1) 関係機関の連携強 遅滞なき資産凍結等の実施強化のため、迅速な制裁対象者情報の通知やベ 令和７年度末 外務省、財務省、経産省、\n化 ストプラクティスの共有など、関係省庁及び特定事業者との連携の枠組み 警察庁、特定事業者監督\nを強化する。 官庁\n(2) 拡散金融に係る事 外為法及び国際テロリスト等財産凍結法で対応すべき事項及びその具体的 令和７年度末 特定事業者監督官庁、財\n業者の理解の向上 な対応方法を特定事業者に対し周知することで、リスク理解の向上につな 務省、警察庁\nげる。\n(3) 外国為替取引等取 外国為替取引等取扱業者による拡散金融対策の態勢整備状況及びリスクに 令和７年度末 財務省\n扱業者に対する拡 応じた対応状況について、経済制裁の迂回・潜脱等の検知を含め、リスク\n散金融に係る検査 ベースでの検査監督を強化する。\n監督の強化\n7",
                        "000万円以上」では全生保が4.7件、民保が4.0件となっている。（図表Ⅰ－21）",
                        "000万円以上」では、全生保が3"
                    ],
                    "faithfulness_score": 1.0,
                    "relevancy_score": 0.0
                }
            ],
            "final_scores": {
                "average_faithfulness": 1.0,
                "average_answer_relevancy": 0.0
            },
            "token_usage": {
                "input_tokens": 5534,
                "output_tokens": 20
            },
            "total_cost": 0.28389549999999997,
            "model_name": "gemini-1.5-flash-latest"
        }
    ]
}