{
    "id": "6eca4c5f-2fc4-43c6-87b7-537d11652d61",
    "createdAt": "2025-08-17T12:34:02.883112+00:00",
    "models_tested": [
        "gpt-4o-mini",
        "gemini-1.5-flash-latest"
    ],
    "advanced_options": {
        "chunking": true,
        "hybridSearch": false,
        "promptTuning": false
    },
    "num_questions": 1,
    "results": [
        {
            "results_by_question": [
                {
                    "question": "f.ドイツのサステナビリティ保証制度の実務訓練は何か月か？",
                    "ground_truth": "少なくとも8か月の実務訓練",
                    "generated_answer": "文脈情報には、ドイツのサステナビリティ保証制度の実務訓練に関する情報が含まれていないため、具体的な回答を提供することはできません。",
                    "retrieved_contexts": [
                        "見通し\n中小企業\n（％ポイント） 見通し\n16年度 17年度 18年度 19年度 20年度 21年度 22年度 23年度 24年度 25年度 26年度 27年度 28年度 29年度 30年度 元年度 2年度 3年度 4年度 5年度 6年度\n■「従業員数判断」BSIの推移\n50\n40\n30\n20\n10\n0\n▲10\n▲20\n▲30\n▲40\n(注)令和6年6月末までの数値は、各調査期における現状判断。\n令和6年9月末及び令和6年12月末の数値は、令和6年4-6月期調査時の見通し。\nシャドー部分は景気後退期を示す。",
                        "見通し\n見通し\n中小企業\n（％ポイント） 見見見通通通ししし\n16年度 17年度 18年度 19年度 20年度 21年度 22年度 23年度 24年度 25年度 26年度 27年度 28年度 29年度 30年度 元年度 2年度 3年度 4年度 5年度 6年度\n●：1-3月期調査時の翌年度の見通し\n○：4-6月期調査時の当年度の見込み\n各調査時期における計数の年度見通しの推移（全規模・全産業） △：7-9月期調査時の当年度の見込み\n□：10-12月期調査時の当年度の見込み\n◇：1-3月期調査時の当年度の見込み\n（１）売上高 (金融業、保険業を除く)\n（前年度比、％）\n8.0\n5.9 6.5",
                        "2024年４月17日決定\nマネロン・テロ資金供与・拡散金融対策政策会議\nマネロン・テロ資金供与・拡散金融対策に関する行動計画（2024-2026 年度）\nIO.1 マネロン・テロ資金供与・拡散金融に係るリスクの認識・協調\n項目 行動内容 期限 担当府省庁等\n(1) ｢政策会議｣の体制 マネロンによる不正な資金の流れの複雑化・多様化に的確に対応するため、 令和６年度末 警察庁、財務省、金融庁、\n強化 マネロン・テロ資金供与・拡散金融対策政策会議（以下、「政策会議」）の 法務省、外務省、その他\n参加省庁拡大等により、｢政策会議｣の体制を強化する。 関係省庁\n(2) 「基本方針」等の進 マネロン・テロ資金供与・拡散金融対策の推進に関する基本方針（2022年 継続実施 同上\n捗管理及び更新 5 月 19 日決定・公表）（以下、「基本方針」）及び本行動計画の進捗状況を\n「政策会議」でフォローアップし、必要に応じ「基本方針」を更新する。\n我が国のマネロン・テロ資金供与・拡散金融対策(以下、｢マネロン等対策｣) 令和６年度末 同上"
                    ],
                    "faithfulness_score": 1.0,
                    "relevancy_score": 0.0
                }
            ],
            "final_scores": {
                "average_faithfulness": 1.0,
                "average_answer_relevancy": 0.0
            },
            "token_usage": {
                "input_tokens": 1986,
                "output_tokens": 69
            },
            "total_cost": 0.04919849999999999,
            "model_name": "gpt-4o-mini"
        },
        {
            "results_by_question": [
                {
                    "question": "f.ドイツのサステナビリティ保証制度の実務訓練は何か月か？",
                    "ground_truth": "少なくとも8か月の実務訓練",
                    "generated_answer": "この文脈には、ドイツのサステナビリティ保証制度の実務訓練に関する情報は含まれていません。そのため、質問に答えることはできません。",
                    "retrieved_contexts": [
                        "見通し\n中小企業\n（％ポイント） 見通し\n16年度 17年度 18年度 19年度 20年度 21年度 22年度 23年度 24年度 25年度 26年度 27年度 28年度 29年度 30年度 元年度 2年度 3年度 4年度 5年度 6年度\n■「従業員数判断」BSIの推移\n50\n40\n30\n20\n10\n0\n▲10\n▲20\n▲30\n▲40\n(注)令和6年6月末までの数値は、各調査期における現状判断。\n令和6年9月末及び令和6年12月末の数値は、令和6年4-6月期調査時の見通し。\nシャドー部分は景気後退期を示す。",
                        "見通し\n見通し\n中小企業\n（％ポイント） 見見見通通通ししし\n16年度 17年度 18年度 19年度 20年度 21年度 22年度 23年度 24年度 25年度 26年度 27年度 28年度 29年度 30年度 元年度 2年度 3年度 4年度 5年度 6年度\n●：1-3月期調査時の翌年度の見通し\n○：4-6月期調査時の当年度の見込み\n各調査時期における計数の年度見通しの推移（全規模・全産業） △：7-9月期調査時の当年度の見込み\n□：10-12月期調査時の当年度の見込み\n◇：1-3月期調査時の当年度の見込み\n（１）売上高 (金融業、保険業を除く)\n（前年度比、％）\n8.0\n5.9 6.5",
                        "2024年４月17日決定\nマネロン・テロ資金供与・拡散金融対策政策会議\nマネロン・テロ資金供与・拡散金融対策に関する行動計画（2024-2026 年度）\nIO.1 マネロン・テロ資金供与・拡散金融に係るリスクの認識・協調\n項目 行動内容 期限 担当府省庁等\n(1) ｢政策会議｣の体制 マネロンによる不正な資金の流れの複雑化・多様化に的確に対応するため、 令和６年度末 警察庁、財務省、金融庁、\n強化 マネロン・テロ資金供与・拡散金融対策政策会議（以下、「政策会議」）の 法務省、外務省、その他\n参加省庁拡大等により、｢政策会議｣の体制を強化する。 関係省庁\n(2) 「基本方針」等の進 マネロン・テロ資金供与・拡散金融対策の推進に関する基本方針（2022年 継続実施 同上\n捗管理及び更新 5 月 19 日決定・公表）（以下、「基本方針」）及び本行動計画の進捗状況を\n「政策会議」でフォローアップし、必要に応じ「基本方針」を更新する。\n我が国のマネロン・テロ資金供与・拡散金融対策(以下、｢マネロン等対策｣) 令和６年度末 同上"
                    ],
                    "faithfulness_score": 1.0,
                    "relevancy_score": 0.0
                }
            ],
            "final_scores": {
                "average_faithfulness": 1.0,
                "average_answer_relevancy": 0.0
            },
            "token_usage": {
                "input_tokens": 1084,
                "output_tokens": 20
            },
            "total_cost": 0.058058,
            "model_name": "gemini-1.5-flash-latest"
        }
    ]
}